{
  "schema": "sfb.view_contract.v1",
  "view_contract_id": "MV16_TRAIN",
  "camera_type": "orthographic",
  "unit": "meters",
  "object_centering": "bbox_center",
  "scale_policy": "fit_80_percent_height",
  "views": [
    { "view_id": "facade_front", "azimuth_deg": 0, "elevation_deg": 10, "role": "facade_ring", "bake_mode": "depth_card" },
    { "view_id": "facade_front_right", "azimuth_deg": 45, "elevation_deg": 10, "role": "facade_ring", "bake_mode": "depth_card" },
    { "view_id": "facade_right", "azimuth_deg": 90, "elevation_deg": 10, "role": "facade_ring", "bake_mode": "depth_card" },
    { "view_id": "facade_back_right", "azimuth_deg": 135, "elevation_deg": 10, "role": "facade_ring", "bake_mode": "depth_card" },
    { "view_id": "facade_back", "azimuth_deg": 180, "elevation_deg": 10, "role": "facade_ring", "bake_mode": "depth_card" },
    { "view_id": "facade_back_left", "azimuth_deg": 225, "elevation_deg": 10, "role": "facade_ring", "bake_mode": "depth_card" },
    { "view_id": "facade_left", "azimuth_deg": 270, "elevation_deg": 10, "role": "facade_ring", "bake_mode": "depth_card" },
    { "view_id": "facade_front_left", "azimuth_deg": 315, "elevation_deg": 10, "role": "facade_ring", "bake_mode": "depth_card" },
    { "view_id": "game_front", "azimuth_deg": 0, "elevation_deg": 45, "role": "gameplay_ring", "bake_mode": "depth_card" },
    { "view_id": "game_front_right", "azimuth_deg": 45, "elevation_deg": 45, "role": "gameplay_ring", "bake_mode": "depth_card" },
    { "view_id": "game_right", "azimuth_deg": 90, "elevation_deg": 45, "role": "gameplay_ring", "bake_mode": "depth_card" },
    { "view_id": "game_back_right", "azimuth_deg": 135, "elevation_deg": 45, "role": "gameplay_ring", "bake_mode": "depth_card" },
    { "view_id": "game_back", "azimuth_deg": 180, "elevation_deg": 45, "role": "gameplay_ring", "bake_mode": "depth_card" },
    { "view_id": "game_back_left", "azimuth_deg": 225, "elevation_deg": 45, "role": "gameplay_ring", "bake_mode": "depth_card" },
    { "view_id": "game_left", "azimuth_deg": 270, "elevation_deg": 45, "role": "gameplay_ring", "bake_mode": "depth_card" },
    { "view_id": "game_front_left", "azimuth_deg": 315, "elevation_deg": 45, "role": "gameplay_ring", "bake_mode": "depth_card" }
  ]
}
